id,name,model_id:id,group_id:id,perm_read,perm_write,perm_create,perm_unlink
project_workflow_design_access_user_types_/_internal_user,project_workflow_design Access User types / Internal User,model_project_workflow_design,base.group_user,1,1,1,1
project_workflow_design_faiblesse_access_user_types_/_internal_user,project_workflow_design_faiblesse Access User types / Internal User,model_project_workflow_design_faiblesse,base.group_user,1,1,1,1
project_workflow_design_force_access_user_types_/_internal_user,project_workflow_design_force Access User types / Internal User,model_project_workflow_design_force,base.group_user,1,1,1,1
project_workflow_design_menace_access_user_types_/_internal_user,project_workflow_design_menace Access User types / Internal User,model_project_workflow_design_menace,base.group_user,1,1,1,1
project_workflow_design_objectif_access_user_types_/_internal_user,project_workflow_design_objectif Access User types / Internal User,model_project_workflow_design_objectif,base.group_user,1,1,1,1
project_workflow_design_opportunite_access_user_types_/_internal_user,project_workflow_design_opportunite Access User types / Internal User,model_project_workflow_design_opportunite,base.group_user,1,1,1,1
project_workflow_design_volet_access_user_types_/_internal_user,project_workflow_design_volet Access User types / Internal User,model_project_workflow_design_volet,base.group_user,1,1,1,1
project_workflow_design_volet_box_access_user_types_/_internal_user,project_workflow_design_volet_box Access User types / Internal User,model_project_workflow_design_volet_box,base.group_user,1,1,1,1
project_workflow_design_volet_liaison_access_user_types_/_internal_user,project_workflow_design_volet_liaison Access User types / Internal User,model_project_workflow_design_volet_liaison,base.group_user,1,1,1,1
